{
  "schemaVersion": "0.1.0",
  "conceptId": "phase2_team_invitation",
  "sourcePackageId": "phase1_team_invitation",
  "compositionId": "team-invitation.component-composition",
  "translationPackDigest": "sha256-543b8641662656715407ff1cd9ab3d599e8a14aa54ac0ba32c558148b755fa84",
  "runtimeVersion": "0.1.0",
  "patterns": [
    "interactive-row-group"
  ],
  "instances": [
    {
      "component": "table",
      "instanceId": "invite-row-group",
      "contractVersion": "0.1.0",
      "props": {
        "loading": false,
        "selectable": false
      },
      "allowedVariants": [
        "default"
      ],
      "allowedStates": [
        "default",
        "loading",
        "empty"
      ],
      "decisionRef": "decision.invitation-row-group"
    },
    {
      "component": "form-field",
      "instanceId": "invite-email-field",
      "repeat": "scenario.rows",
      "contractVersion": "0.1.0",
      "props": {},
      "allowedVariants": [
        "default"
      ],
      "allowedStates": [
        "default",
        "error"
      ],
      "decisionRef": "decision.form-field"
    },
    {
      "component": "text-field",
      "instanceId": "invite-email-input",
      "repeat": "scenario.rows",
      "contractVersion": "0.1.0",
      "props": {
        "size": "md",
        "disabled": false
      },
      "allowedVariants": [
        "default"
      ],
      "allowedStates": [
        "default",
        "error",
        "disabled",
        "readonly"
      ],
      "decisionRef": "decision.email-field"
    },
    {
      "component": "form-field",
      "instanceId": "invite-role-field",
      "repeat": "scenario.rows",
      "contractVersion": "0.1.0",
      "props": {},
      "allowedVariants": [
        "default"
      ],
      "allowedStates": [
        "default",
        "error"
      ],
      "decisionRef": "decision.form-field"
    },
    {
      "component": "select",
      "instanceId": "invite-role-select",
      "repeat": "scenario.rows",
      "contractVersion": "0.1.0",
      "props": {
        "size": "md",
        "disabled": false
      },
      "allowedVariants": [
        "default"
      ],
      "allowedStates": [
        "default",
        "error",
        "disabled"
      ],
      "decisionRef": "decision.role-select"
    },
    {
      "component": "validation-message",
      "instanceId": "invite-validation-message",
      "repeat": "scenario.rows",
      "contractVersion": "0.1.0",
      "props": {
        "variant": "error"
      },
      "allowedVariants": [
        "error",
        "warning",
        "success"
      ],
      "allowedStates": [
        "default"
      ],
      "decisionRef": "decision.validation-message"
    },
    {
      "component": "status-indicator",
      "instanceId": "invite-row-status",
      "repeat": "scenario.rows",
      "contractVersion": "0.1.0",
      "props": {
        "variant": "idle"
      },
      "allowedVariants": [
        "success",
        "running",
        "warning",
        "error",
        "idle"
      ],
      "allowedStates": [
        "default"
      ],
      "decisionRef": "decision.row-status"
    },
    {
      "component": "alert",
      "instanceId": "invite-page-alert",
      "contractVersion": "0.1.0",
      "props": {
        "variant": "warning"
      },
      "allowedVariants": [
        "info",
        "success",
        "warning",
        "danger"
      ],
      "allowedStates": [
        "default"
      ],
      "decisionRef": "decision.page-alert"
    },
    {
      "component": "checkbox",
      "instanceId": "owner-confirmation",
      "contractVersion": "0.1.0",
      "props": {
        "checked": false,
        "disabled": false,
        "label": "付与される権限と影響を理解しました"
      },
      "allowedVariants": [
        "default"
      ],
      "allowedStates": [
        "default",
        "checked",
        "disabled"
      ],
      "decisionRef": "decision.owner-confirmation"
    },
    {
      "component": "button",
      "instanceId": "invite-action",
      "repeat": "prototype.actions",
      "contractVersion": "0.2.0",
      "props": {
        "variant": "primary",
        "size": "md",
        "loading": false,
        "disabled": false,
        "fullWidth": false
      },
      "allowedVariants": [
        "primary",
        "secondary",
        "ghost"
      ],
      "allowedStates": [
        "default",
        "disabled",
        "loading"
      ],
      "decisionRef": "decision.invite-action"
    }
  ],
  "decisions": [
    {
      "id": "decision.form-field",
      "component": "form-field",
      "reason": "各行のlabel、control、validation messageを明示的なID relationで束ねるため。",
      "sourceRefs": [
        "component.form-field.accessibility",
        "phase1_team_invitation"
      ]
    },
    {
      "id": "decision.invitation-row-group",
      "component": "table",
      "reason": "複数宛先のEmail、Role、Statusを列方向に比較しながら編集するため。",
      "sourceRefs": [
        "component.table.intent",
        "phase1_team_invitation"
      ]
    },
    {
      "id": "decision.email-field",
      "component": "text-field",
      "reason": "短いEmail文字列の入力と行単位error associationが必要なため。",
      "sourceRefs": [
        "component.text-field.intent",
        "phase1_team_invitation"
      ]
    },
    {
      "id": "decision.role-select",
      "component": "select",
      "reason": "Owner、Admin、Member、Viewerの有限な単一選択であるため。",
      "sourceRefs": [
        "component.select.intent",
        "phase1_team_invitation"
      ]
    },
    {
      "id": "decision.validation-message",
      "component": "validation-message",
      "reason": "入力行の問題と修正方法をcontrolへ関連付けて示すため。",
      "sourceRefs": [
        "component.validation-message.accessibility",
        "phase1_team_invitation"
      ]
    },
    {
      "id": "decision.row-status",
      "component": "status-indicator",
      "reason": "Pending、送信済み、失敗を反復行内で短く非色依存に示すため。",
      "sourceRefs": [
        "component.status-indicator.intent",
        "phase1_team_invitation"
      ]
    },
    {
      "id": "decision.page-alert",
      "component": "alert",
      "reason": "Seat不足、Owner権限、送信結果を説明と回復行動を含めて示すため。",
      "sourceRefs": [
        "component.alert.intent",
        "phase1_team_invitation"
      ]
    },
    {
      "id": "decision.owner-confirmation",
      "component": "checkbox",
      "reason": "Ownerを含む場合だけ明示的な二値確認を要求するため。",
      "sourceRefs": [
        "component.checkbox.intent",
        "phase1_team_invitation"
      ]
    },
    {
      "id": "decision.invite-action",
      "component": "button",
      "reason": "招待送信は画面の最終確定actionであり、同じ意思決定文脈のprimaryは1件だけにするため。",
      "sourceRefs": [
        "component.button.selection.primary",
        "phase1_team_invitation"
      ]
    }
  ],
  "exceptions": [],
  "renderSites": [
    {
      "usageId": "invite-action",
      "component": "button",
      "callCount": 10
    },
    {
      "usageId": "invite-email-field",
      "component": "form-field",
      "callCount": 1
    },
    {
      "usageId": "invite-email-input",
      "component": "text-field",
      "callCount": 1
    },
    {
      "usageId": "invite-page-alert",
      "component": "alert",
      "callCount": 4
    },
    {
      "usageId": "invite-role-field",
      "component": "form-field",
      "callCount": 1
    },
    {
      "usageId": "invite-role-select",
      "component": "select",
      "callCount": 1
    },
    {
      "usageId": "invite-row-group",
      "component": "table",
      "callCount": 1
    },
    {
      "usageId": "invite-row-status",
      "component": "status-indicator",
      "callCount": 3
    },
    {
      "usageId": "invite-validation-message",
      "component": "validation-message",
      "callCount": 1
    },
    {
      "usageId": "owner-confirmation",
      "component": "checkbox",
      "callCount": 1
    }
  ],
  "validationDigest": "sha256-4a1e78f02222191b8c9ace4cd402f52de70de5f186e12cb0f2aa92bd85f0da8d"
}
